Название,Цена
Диван Льери Мини Velvet Light,56990
Диван Нумо Velvet Yellow,35990
Диван Тут Рядом Дом Серо-графитовый,69990
Диван угловой Ройн Мини Velvet Olive,39990
Диван угловой Эби-1 Velvet Coral,69990
Диван Бруквиль Velvet Blue,46990
Диван Тут Рядом Космос Светло-Бежевый,109990
Диван Линс Velvet Navy Blue,26990
Диван Нумо Мини Textile Yellow,22990
Диван Байма Velvet Grey,66990
Кресло Тут Рядом Дом Сине-бежевый,49990
Диван угловой Беллер Textile Yellow,36990
Кресло Бенел Cozy Ivory,30990
Диван Нумо Velvet Grafit,35990
Пуф Тут Рядом Дом Серо-графитовый,14990
Диван Роттердам Velvet Yellow,23990
Диван Сваут Velvet Grey,62990
Пуф Дадли Velvet Ocean,3290
Диван Линс Velvet Grafit,26990
Диван Рейли Velvet Coral,29990
Диван угловой Дарол Happy Grey,59990
Пуф Тут Рядом Красавчик Светло-бежевый,32990
Диван Коренс Happy Grey,28990
Диван угловой Шера Velvet Light,99990
Кресло Дженкс Happy Emerald,20990
Диван Види Textile Ocean,22990
Пуф Тут Рядом Дом Зеленый,14990
Кресло Гета Soft Silver,29990
Диван угловой Нумо Velvet Yellow,44990
Диван Тут Рядом Дом Сине-бежевый,69990
Диван Сваут Velvet Mustard,62990
Кресло Элвит Cozy Ivory,25990
Модульный диван Сэндж 2 Textile Yellow,55970
Пуф Лонди Cozy Beige,12990
Кресло Тут Рядом Дом Розовый,49990
Диван Нумо Мини Textile Light,22990
Диван Рейли Velvet Mint,29990
Диван Бонс-Т Happy Yellow,39990
Диван Риббл-2 Bucle Lilac,62990
Диван угловой Маркфул Velvet Ocean,76990
Кушетка Роби Textile Coral,16990
Диван угловой Нумо Velvet Grey,44990
Пуф Тут Рядом Красавчик Оранжевый,26990
Кушетка Оренте Soft Sky,39990
Пуф Бане Cozy Ginger,7990
Банкетка Аймо Textile Light,7990
Диван Лонди Mima Pink,82990
Кушетка Оренте Cozy White,52990
Кресло Элвит Cozy Emerald,25990
Кресло Тут Рядом Космос-2 Графитовый,79990
Пуф Динс Velvet Yellow,6990
Кресло Тут Рядом Космос-2 Светло-Бежевый,79990
Пуф Тут Рядом Дом Синий,14990
Кресло Тут Рядом Космос-1 Серый,54990
Пуф Динс Velvet Milk,6990
Диван угловой Аронт Мини Velvet Light,49990
Кресло Лонди Mima Pink,66990
Кресло Тут Рядом Космос-1 Желтый,54990
Диван угловой Шера Velvet Olive,99990
Диван Тут Рядом Дом Розовый,69990
Пуф Поул Bucle Pink,11990
Кресло Тут Рядом Космос-2 Серый,79990
Кресло Гета Soft Light,29990
Пуф Кофи-2 Galaxy Birds,5990
Пуф Лонди Mima Pink,17990
Диван угловой Шера Velvet Terra,99990
Диван Самми Velvet Grey,26990
Диван угловой Аронт Мини Velvet Smoke,49990
Кушетка Тут Рядом Космос Бежевый,89990
Диван Тут Рядом Космос Серый,109990
Пуф Каве Velvet Violet,9990
Модульный диван Риббл-3 Bucle Forest,141970
Кресло Бенел Cozy Beige,30990
Банкетка Кото Bucle Galaxy,18990
Кресло Носта Bucle Blue,24990
Диван угловой Шера Velvet Blue,99990
Кушетка Кото Cozy Storm,39990
Пуф Кото Cozy Dove,7990
Кресло Кото Cozy Beige,26990
Кушетка Олтен Bucle Shadow,29990
Диван Арклоу Cozy Ivory,44990
Модульный диван Brera-3 Velour Night,104970
Диван Ларонсо Textile Night,84990
Диван Тут Рядом Космос Графитовый,109990
Диван Рон Textile Beige,46990
Пуф Клаум Linia Light,4990
Кресло Кото Cozy Latte,26990
Диван угловой Биани-2 Barhat Olive,94990
Пуф Плиди Velvet Yellow,4990
Диван Марей Soft Olive,89990
Кресло-кровать Динс Мини Velvet Silver,28990
Модульный диван Этен 4 Vertical Mix,183920
Диван Лофт Linia Ginger,39990
Диван угловой Лаберт Barhat Beige,99990
Модульный диван Brera-8 Velour Olive,117970
Пуф Кото Cozy Emerald,7990
